{
  "$fixture": true,
  "problems": [
    {
      "problem_id": "cumcm-2024-B",
      "competition_id": "cumcm",
      "year": 2024,
      "problem_code": "B",
      "problem_types": [
        "optimization",
        "prediction",
        "statistical_analysis"
      ],
      "method_tags": [
        "integer_programming"
      ],
      "data_tags": [
        "tabular"
      ],
      "domain_tags": [
        "manufacturing"
      ],
      "subproblems": [
        {
          "subproblem_id": "cumcm-2024-B:q1",
          "problem_types": [
            "optimization"
          ],
          "method_tags": [
            "integer_programming"
          ],
          "confidence": 0.9,
          "label_status": "pending_review",
          "source": null,
          "provenance": {
            "kind": "unknown",
            "evidence": null,
            "note": "开发夹具，尚未提取或人工确认"
          }
        },
        {
          "subproblem_id": "cumcm-2024-B:q2",
          "problem_types": [
            "prediction",
            "statistical_analysis"
          ],
          "confidence": null,
          "label_status": "unknown",
          "provenance": {
            "kind": "unknown",
            "evidence": null,
            "note": "开发夹具，尚未提取或人工确认"
          },
          "method_tags": [
            "time_series"
          ],
          "data_tags": [
            "time_series"
          ]
        }
      ],
      "source_refs": [],
      "source_sha256": null,
      "attachments": [],
      "schema_version": 1,
      "review_status": "pending_review",
      "profile_version": 1,
      "confidence": null,
      "label_status": "unknown",
      "provenance": {
        "kind": "unknown",
        "evidence": null,
        "note": "开发夹具，尚未提取或人工确认"
      },
      "source_asset_ref": null
    }
  ],
  "cases": [
    {
      "case_id": "cumcm-2024-B-case-001",
      "problem_id": "cumcm-2024-B",
      "competition_id": "cumcm",
      "source_sha256": "e3b0c44298fc1c149afbf4c8996fb92427ae41e4649b934ca495991b7852b855",
      "extractor_version": "v0.1",
      "schema_version": 1,
      "profile_version": 1,
      "review_status": "pending_review",
      "license": {
        "internal_analysis": true,
        "distribute_original": false,
        "distribute_profile": false,
        "send_to_third_party_model": false
      },
      "structure": [],
      "writing": [],
      "length": {
        "zh_chars": null,
        "en_words": null,
        "statistical_basis": null,
        "missing": [],
        "zh_parts": {
          "body": null,
          "abstract": null,
          "toc": null,
          "appendix": null
        },
        "en_parts": {
          "body": null,
          "abstract": null,
          "toc": null,
          "appendix": null
        },
        "section_ratios": []
      },
      "figures": [],
      "resolution_status": "resolved",
      "publication_status": "staging",
      "source_asset_ref": {
        "asset_id": "cumcm-case-001-paper",
        "version": 1,
        "sha256": "e3b0c44298fc1c149afbf4c8996fb92427ae41e4649b934ca495991b7852b855"
      },
      "license_evidence": {
        "record_id": "fixture-internal-review",
        "relative_path": "fixtures/authorization.json"
      }
    },
    {
      "case_id": "cumcm-2024-B-case-002",
      "problem_id": "cumcm-2024-B",
      "competition_id": "cumcm",
      "source_sha256": null,
      "extractor_version": null,
      "schema_version": 1,
      "profile_version": 1,
      "review_status": "unknown",
      "license": {
        "internal_analysis": false,
        "distribute_original": false,
        "distribute_profile": false,
        "send_to_third_party_model": false
      },
      "structure": [],
      "writing": [],
      "length": {
        "zh_chars": null,
        "en_words": null,
        "statistical_basis": null,
        "missing": [
          "未授权"
        ],
        "zh_parts": {
          "body": null,
          "abstract": null,
          "toc": null,
          "appendix": null
        },
        "en_parts": {
          "body": null,
          "abstract": null,
          "toc": null,
          "appendix": null
        },
        "section_ratios": []
      },
      "figures": [],
      "resolution_status": "resolved",
      "publication_status": "staging",
      "source_asset_ref": null,
      "license_evidence": null
    }
  ],
  "assets": [
    {
      "asset_id": "cumcm-case-001-paper",
      "role": "case_paper",
      "competition_id": "cumcm",
      "owner_id": "cumcm-2024-B-case-001",
      "version": 1,
      "oss_key": "content/cumcm/cases/cumcm-2024-B-case-001/v1/paper.pdf",
      "sha256": "e3b0c44298fc1c149afbf4c8996fb92427ae41e4649b934ca495991b7852b855",
      "size_bytes": 123456,
      "media_type": "application/pdf",
      "license_status": "internal_only",
      "schema_version": 1,
      "license": {
        "internal_analysis": true,
        "distribute_original": false,
        "distribute_profile": false,
        "send_to_third_party_model": false
      },
      "license_evidence": {
        "record_id": "fixture-internal-review",
        "relative_path": "fixtures/authorization.json"
      }
    },
    {
      "asset_id": "cumcm-layout-latex",
      "role": "template_layout",
      "competition_id": "cumcm",
      "owner_id": "cumcm-default",
      "version": 1,
      "oss_key": "fixtures/cumcm/cumcm-layout-latex.json",
      "sha256": "5c59c76c9f0fc02c0f8794069ca2dbd82b5f449e52f2e48bba1d5b09c33d6ef1",
      "size_bytes": 10,
      "media_type": "application/zip",
      "license_status": "internal_only",
      "license": {
        "internal_analysis": true,
        "distribute_original": false,
        "distribute_profile": false,
        "send_to_third_party_model": false
      },
      "license_evidence": {
        "record_id": "fixture-review",
        "relative_path": "fixtures/authorization.json"
      },
      "schema_version": 1,
      "format": "latex"
    },
    {
      "asset_id": "cumcm-layout-docx",
      "role": "template_layout",
      "competition_id": "cumcm",
      "owner_id": "cumcm-default",
      "version": 1,
      "oss_key": "fixtures/cumcm/cumcm-layout-docx.json",
      "sha256": "ce0893c1ebdd158469767b0c037e784fcbe7ff06b2ffd27761685ceec972078a",
      "size_bytes": 10,
      "media_type": "application/vnd.openxmlformats-officedocument.wordprocessingml.document",
      "license_status": "internal_only",
      "license": {
        "internal_analysis": true,
        "distribute_original": false,
        "distribute_profile": false,
        "send_to_third_party_model": false
      },
      "license_evidence": {
        "record_id": "fixture-review",
        "relative_path": "fixtures/authorization.json"
      },
      "schema_version": 1,
      "format": "docx"
    },
    {
      "asset_id": "cumcm-outline",
      "role": "template_outline",
      "competition_id": "cumcm",
      "owner_id": "cumcm-outline",
      "version": 1,
      "oss_key": "fixtures/cumcm/cumcm-outline.json",
      "sha256": "735e623bf288b29cf96ea3e269a3d3a7169fdab96bc397ae5214b6dd2ff87176",
      "size_bytes": 10,
      "media_type": "application/json",
      "license_status": "internal_only",
      "license": {
        "internal_analysis": true,
        "distribute_original": false,
        "distribute_profile": false,
        "send_to_third_party_model": false
      },
      "license_evidence": {
        "record_id": "fixture-review",
        "relative_path": "fixtures/authorization.json"
      },
      "schema_version": 1
    },
    {
      "asset_id": "cumcm-policy",
      "role": "writing_policy",
      "competition_id": "cumcm",
      "owner_id": "cumcm-default",
      "version": 1,
      "oss_key": "fixtures/cumcm/cumcm-policy.json",
      "sha256": "2171172da7c6e162fb55afe0c178b1f41f9b652322007cdb03df5925a034279d",
      "size_bytes": 10,
      "media_type": "application/json",
      "license_status": "internal_only",
      "license": {
        "internal_analysis": true,
        "distribute_original": false,
        "distribute_profile": false,
        "send_to_third_party_model": false
      },
      "license_evidence": {
        "record_id": "fixture-review",
        "relative_path": "fixtures/authorization.json"
      },
      "schema_version": 1
    },
    {
      "asset_id": "cumcm-figure",
      "role": "figure_style",
      "competition_id": "cumcm",
      "owner_id": "cumcm-figure",
      "version": 1,
      "oss_key": "fixtures/cumcm/cumcm-figure.json",
      "sha256": "7676476536c298b5946e6d855f01ea21acd58f17aaadd7deb64ea9d45e5054f8",
      "size_bytes": 10,
      "media_type": "application/json",
      "license_status": "internal_only",
      "license": {
        "internal_analysis": true,
        "distribute_original": false,
        "distribute_profile": false,
        "send_to_third_party_model": false
      },
      "license_evidence": {
        "record_id": "fixture-review",
        "relative_path": "fixtures/authorization.json"
      },
      "schema_version": 1
    },
    {
      "asset_id": "cumcm-table",
      "role": "table_style",
      "competition_id": "cumcm",
      "owner_id": "cumcm-table",
      "version": 1,
      "oss_key": "fixtures/cumcm/cumcm-table.json",
      "sha256": "2ca054dce33a9adf3c59e5d4fe8105aa93c36b9f82250c20a9de31b7217049e5",
      "size_bytes": 10,
      "media_type": "application/json",
      "license_status": "internal_only",
      "license": {
        "internal_analysis": true,
        "distribute_original": false,
        "distribute_profile": false,
        "send_to_third_party_model": false
      },
      "license_evidence": {
        "record_id": "fixture-review",
        "relative_path": "fixtures/authorization.json"
      },
      "schema_version": 1
    },
    {
      "asset_id": "cumcm-rules",
      "role": "ruleset",
      "competition_id": "cumcm",
      "owner_id": "cumcm-2026",
      "version": 1,
      "oss_key": "fixtures/cumcm/cumcm-rules.json",